title,tagline,release_date,runtime,budget,revenue,popularity,vote_average,vote_count
Dance Flick,,2009-05-22,83.0,0,0,7.326034,4.7,71
The Gambler,The only way out is all in,2014-12-25,111.0,25000000,39171130,22.622453,5.7,543
Dear John,Love brought them together. Will fate tear them apart?,2010-02-04,115.0,25000000,114977104,19.402816,6.6,1262
The Losers,Anyone Else Would Be Dead By Now.,2010-04-23,97.0,25000000,23580000,24.903418,6.2,515
Punch-Drunk Love,,2002-10-25,95.0,25000000,17000000,15.960916000000001,6.9,530
EuroTrip,No actual Europeans were harmed in the making of this film.,2004-02-20,93.0,25000000,20796847,25.848003,6.5,656
The Box,All you have to do is push the button.,2009-09-17,115.0,30000000,33333531,21.606001000000003,5.4,597
The Ruins,Terror has evolved.,2008-04-02,91.0,8000000,0,13.715715,5.6,265
The Girl Next Door,Matt never saw her coming... but all his friends had!,2004-04-09,108.0,25000000,30411183,39.784026000000004,6.3,824
Maximum Risk,The Other Side of Safety.,1996-09-13,100.0,25000000,51702483,10.115011,5.2,101
Stealing Harvard,Their intentions were honorable. Their methods were criminal.,2002-09-13,85.0,0,0,7.321181,4.4,46
Hot Rod,Smack destiny in the face.,2007-08-03,88.0,0,14334401,6.3095870000000005,6.3,313
Shark Night,Terror runs deep.,2011-09-02,91.0,28000000,10126458,8.363702,4.9,132
Big Trouble in Little China,Adventure doesn't come any bigger!,1986-05-30,99.0,25000000,11000000,29.796394,7.1,705
Warrior,Fight for Family,2011-09-09,140.0,25000000,23057115,51.915025,7.7,1272
Michael Collins,"Ireland, 1916. His Dreams Inspired Hope. His Words Ignited Passion. His Courage Forged A Nation's Destiny.",1996-10-25,132.0,28000000,16900000,8.314624,6.7,97
Abandon,Watch who you leave behind.,2002-10-14,99.0,25000000,10719357,3.888776,4.6,45
Straw Dogs,Everyone Has A Breaking Point,2011-09-16,110.0,25000000,10324441,7.473455,5.5,144
The Hoax,Never let the truth get in the way of a good story.,2006-10-14,116.0,25000000,11772461,5.073536,6.4,60
Sheena,,1984-08-17,117.0,25000000,5778353,4.020194,5.0,22
Underclassman,,2005-09-02,95.0,0,0,2.083856,5.5,28
Say It Isn't So,,2001-03-12,95.0,25000000,0,2.9093459999999998,4.8,47
Blindness,,2008-05-14,121.0,25000000,19844979,17.603823000000002,6.4,387
Without Limits,PRE. The way he competed. The way he lived his life.,1998-09-11,117.0,25000000,777423,3.849873,6.2,19
A Turtle's Tale: Sammy's Adventures,He's Turtly Amazing,2010-08-03,88.0,0,0,15.805449,5.6,151
Little White Lies,The one thing friends can't escape is a few home truths.,2010-10-20,154.0,25000000,48531470,15.279020999999998,7.1,380
Love Ranch,When It Comes To Love... Everyone Pays A Price.,2010-06-30,117.0,0,0,5.000126,6.0,21
The True Story of Puss 'n Boots,,2009-04-01,82.0,0,0,1.684948,3.8,7
Space Dogs,,2010-03-18,85.0,25000000,6500000,5.753564,6.3,10
Red Sky,Go Rogue,2014-03-12,100.0,25000000,0,3.344158,4.1,26
Dangerous Liaisons,Lust. Seduction. Revenge. The Game As You've Never Seen It Played Before.,1988-12-16,119.0,14000000,34670720,14.480628,7.0,257
On the Road,The best teacher is experience.,2012-05-22,137.0,25000000,8784318,14.613152,5.5,301
Star Trek IV: The Voyage Home,The key to saving the future can only be found in the past.,1986-11-25,119.0,24000000,133000000,22.258428,6.9,477
Scream 2,Someone has taken their love of sequels one step too far.,1997-12-09,120.0,24000000,172363301,35.244037,6.1,840
Think Like a Man Too,,2014-06-20,105.0,24000000,70181428,15.237142,6.4,225
The Whole Nine Yards,"In the heart of suburbia, a hit man with heart has just moved in.",2000-02-18,98.0,41300000,106371651,23.441135,6.2,531
Footloose,,1984-02-17,107.0,8200000,80035402,25.03414,6.4,505
Old School,"All the fun of college, none of the education.",2003-02-21,91.0,24000000,87055349,24.70166,6.6,541
Nurse Betty,She's chasing a dream... they're chasing her.,2000-09-08,108.0,24000000,0,3.572339,5.9,111
Double Take,One big shot. One big mouth. The switch is on.,2001-01-12,88.0,0,0,1.903405,5.5,24
Win a Date with Tad Hamilton!,"In every love story, there's only room for one leading man.",2004-01-23,95.0,17000000,16980098,7.701041,5.5,160
Muppets from Space,Space. It's not as deep as you think.,1999-07-14,87.0,24000000,16290976,6.589192999999999,5.8,92
Ready to Rumble,They're headed to the big time...face first.,2000-04-07,107.0,24000000,12372410,3.113009,4.7,49
Beyond the Sea,"In the era of cool, Bobby Darin was the soundtrack.",2004-12-17,118.0,23000000,0,6.1382129999999995,6.5,55
Meet the Deedles,Fish out of water...Surfers in Yellowstone,1998-03-27,93.0,24000000,4562146,2.353441,4.1,19
The Waterboy,You can mess with him. But don't mess with his water.,1998-11-06,90.0,23000000,185991646,23.839126999999998,5.9,512
The Empire Strikes Back,The Adventure Continues...,1980-05-17,124.0,18000000,538400000,78.51783,8.2,5879
The Ides of March,Ambition seduces. Power corrupts.,2011-09-24,101.0,12500000,75993061,20.317469,6.5,910
Pitch Black,Don't be afraid of the dark. Be afraid of what's in the dark,2000-02-18,108.0,23000000,53187659,18.493202,6.7,1789
Someone Like You...,The story about the one that got away and the one she never saw coming.,2001-03-30,97.0,23000000,0,7.901891,6.0,118
Her,A Spike Jonze Love Story,2013-12-18,126.0,23000000,47351251,53.682367000000006,7.9,4097
Joy Ride,"It was just a joke, just for fun.",2001-10-05,97.0,23000000,36642838,11.183197,6.3,325
Marvin's Room,A story about the years that keep us apart... And the moments that bring us together.,1996-12-18,98.0,0,0,6.130231,6.6,124
The End of the Affair,,1999-12-03,102.0,23000000,10827816,6.921263000000001,6.6,55
Coco Before Chanel,Before she was France's famous mademoiselle...,2009-04-22,110.0,0,0,8.426589,6.6,246
Cheri,,2009-02-10,86.0,23000000,9366227,5.494047,5.9,56
Vanity Fair,"On September 1st, a heroine will rise.",2004-09-01,141.0,23000000,16123851,6.618149000000001,5.5,73
Bodyguards and Assassins,"To save a nations future, they must protect one man from its past.",2009-12-18,139.0,23000000,5837674,7.876883,6.5,57
1408,The only demons in room 1408 are those within you.,2007-07-12,104.0,25000000,94679598,35.169779,6.5,1343
Ghost,A love that will last forever.,1990-07-12,127.0,22000000,505000000,41.967005,6.9,1339
The Rookie,Sometimes dreams come back to life.,2002-03-25,127.0,20000000,75597042,11.263361,6.5,110
The Game Plan,"Half his size, twice the trouble ... and she's moving in.",2007-09-28,110.0,22000000,147880543,20.699212,6.0,428
The Animal,He wasn't much of a man... Now he's not much of an animal!,2001-06-01,84.0,22000000,84772742,13.786075,4.6,304
Gandhi,His triumph changed the world forever.,1982-11-30,191.0,22000000,77737889,35.227212,7.4,716
The Hundred-Foot Journey,Life's greatest journey begins with the first step.,2014-08-06,122.0,22000000,88880821,27.898438,7.3,508
Son of God,Their Empire. His Kingdom.,2014-02-28,138.0,22000000,67800064,9.175761999999999,5.9,83
Underworld,Underworld,2003-09-19,121.0,22000000,95708457,81.829237,6.6,2512
The Informant!,Based on a tattle-tale.,2009-09-18,108.0,22000000,35424826,17.772517999999998,6.0,301
Shadowlands,,1993-12-25,131.0,22000000,0,5.609755000000001,6.8,61
Delivery Man,You're never quite ready for what life delivers.,2013-10-10,105.0,26000000,51164106,30.114383,6.2,551
Our Kind of Traitor,Who Can You Trust With The Truth?,2016-05-05,108.0,0,9930095,10.547959,6.0,160
Saving Silverman,They swore nothing would come between them. Then evil walked in the door,2001-02-09,90.0,22000000,19351569,12.887673,5.4,154
Jay and Silent Bob Strike Back,Hollywood had it coming,2001-08-22,104.0,22000000,33788161,21.865021,6.4,480
The Glass House,The glass is about to be shattered...,2001-09-14,106.0,30000000,23619609,9.448516999999999,5.4,201
"Hail, Caesar!",Lights. Camera. Abduction.,2016-02-05,106.0,22000000,63647656,39.006187,5.7,1309
I Heart Huckabees,An existential comedy,2004-09-10,106.0,22000000,0,14.925633,6.2,239
Megiddo: The Omega Code 2,"In The Beginning, The End Had A Name.",2001-09-07,104.0,0,0,0.809588,3.6,8
Darling Lili,She gave away secrets to one side and her heart to the other.,1970-01-01,107.0,0,0,0.816883,4.9,8
The Libertine,He didn't resist temptation. He pursued it.,2004-09-16,114.0,0,0,7.588597,5.9,128
Hit & Run,A Comedy That Never Takes Its Foot Off The Gas,2012-08-22,100.0,2000000,14400000,16.668854,5.5,224
Before I Go to Sleep,Who do you trust?,2014-09-03,92.0,22000000,15447154,48.784734,6.2,659
Sorcerer,WANTED. Four men willing to drive a cargo of death to escape a life in hell.,1977-06-24,121.0,22000000,12000000,9.088208999999999,7.4,98
Stone,Some People Tell Lies. Others Live Them.,2010-10-07,105.0,22000000,9479718,12.445176,5.2,192
Out of the Furnace,Sometimes your battles choose you.,2013-12-06,116.0,22000000,15400000,29.230297999999998,6.5,720
To Rome with Love,,2012-04-20,111.0,17000000,73244881,15.013385999999999,5.6,546
"South Park: Bigger, Longer & Uncut",UH-OH.,1999-06-30,81.0,21000000,0,27.197799,7.1,893
Death at a Funeral,From director Frank Oz comes the story of a family that puts the F U in funeral.,2007-02-09,90.0,9000000,46,20.410354,6.9,497
Teenage Mutant Ninja Turtles III,The Turtles Are Back....In Time.,1993-03-17,96.0,21000000,42000000,10.207065,5.1,184
Hardball,The most important thing in life is showing up,2001-09-14,106.0,32000000,40222729,5.683281,6.3,123
Freedom Writers,Their story. Their world. Their future.,2007-01-05,123.0,21000000,41170784,17.746980999999998,7.5,356
For Colored Girls,Many voices. One poem.,2010-11-05,134.0,0,37000000,1.9345240000000001,7.0,22
Never Back Down,Win or lose... Everyone has their fight.,2008-03-04,115.0,20000000,41627431,26.21425,6.4,497
Tinker Tailor Soldier Spy,How do you find an enemy who is hidden right before your eyes?,2011-09-16,127.0,30000000,0,33.649652,6.6,840
Molly,Innocence is bliss. See the world through her.,1999-10-22,102.0,0,0,2.636193,5.5,14
The Beaver,He's here to save Walter's life.,2011-02-11,91.0,21000000,970816,13.847872,6.3,276
Raiders of the Lost Ark,Indiana Jones - the new hero from the creators of JAWS and STAR WARS.,1981-06-12,115.0,18000000,389925971,68.159596,7.7,3854
Home Alone 2: Lost in New York,He's up past his bedtime in the city that never sleeps.,1992-11-19,120.0,18000000,358991681,81.487685,6.3,2395
Close Encounters of the Third Kind,We are not alone.,1977-11-16,135.0,20000000,303788635,52.45650500000001,7.2,1098
Beverly Hills Cop II,,1987-05-18,100.0,20000000,299965036,25.28436,6.1,613
Bringing Down the House,"Everything he needed to know about life, she learned in prison.",2003-03-07,105.0,20000000,132675402,8.351385,5.4,183
The Silence of the Lambs,To enter the mind of a killer she must challenge the mind of a madman.,1991-02-01,119.0,19000000,272742922,18.174804,8.1,4443
Wayne's World,You'll laugh. You'll cry. You'll hurl.,1992-02-14,94.0,20000000,121697323,21.815122,6.5,728
Beverly Hills Chihuahua,50% Warrior. 50% Lover. 100% Chihuahua.,2008-10-03,91.0,20000000,149281606,12.25264,4.9,209
The Conjuring,Based on the true case files of the Warrens,2013-07-18,112.0,13000000,318000141,49.975409,7.4,3092
Are We There Yet?,24 hours. 350 miles. His girlfriend's kids. What could possibly go wrong?,2005-01-20,95.0,32000000,97918663,13.590677,5.2,221
Tammy,She hit the road. The road hit back.,2014-07-02,97.0,20000000,100525432,21.657563,5.0,500
Mortal Kombat,Nothing In This World Has Prepared You For This.,1995-08-18,101.0,18000000,122195920,16.470895000000002,5.4,442
The Descendants,The South Pacific ain't that terrific.,2011-09-09,115.0,20000000,177243185,40.903931,6.7,934
The Last Song,"A story about family, first love, second chances and the moment in life that lead you back home.",2010-03-31,107.0,0,0,23.139971,6.9,923
12 Years a Slave,The extraordinary true story of Solomon Northup,2013-10-18,134.0,20000000,187000000,95.9229,7.9,3674
Drumline,Half time is game time,2002-12-13,118.0,20000000,57588485,4.748929,6.2,116
Why Did I Get Married Too?,Marriage is an institution they're committed to.,2010-04-02,121.0,20000000,60072596,2.986286,6.1,29
Edward Scissorhands,His scars run deep.,1990-12-05,105.0,20000000,53000000,47.51363,7.5,3601
The French Connection,There are no rules and no holds barred when Popeye cuts loose!,1971-10-09,104.0,1800000,41158757,15.978136,7.4,422
Bad Moms,Party like a mother.,2016-07-28,100.0,20000000,183936074,42.512296,6.3,1252
Date Movie,An Unprotected Comedy,2006-02-17,83.0,20000000,48548426,10.098722,3.6,222
Boogeyman,You thought it was just a story.,2005-02-04,89.0,20000000,67192859,11.62423,4.6,191
The Tigger Movie,,2000-02-11,77.0,30000000,45554533,9.829858999999999,6.3,143
Orphan,Can you keep a secret?,2009-07-24,123.0,20000000,41596251,29.295801,6.7,1261
Epic Movie,We know it's big. We measured.,2007-01-25,86.0,20000000,86865564,6.0646379999999995,3.2,326
Spotlight,Break the story. Break the silence.,2015-11-06,128.0,20000000,88346473,41.503588,7.8,2686
How Stella Got Her Groove Back,Sometimes you have to break the rules to free your heart.,1998-08-14,124.0,20000000,37672350,2.003047,6.0,24
Bill & Ted's Bogus Journey,Once... they made history. Now... they are history.,1991-07-19,98.0,0,0,11.349664,5.9,308
Man of the Year,Elections are made to be broken.,2006-10-09,115.0,20000000,41237648,11.203335000000001,5.8,129
The American,,2010-08-31,104.0,20000000,65464324,18.632156,5.8,481
Selena,Discover the true story of one of America's brightest stars... that faded too soon.,1997-03-21,127.0,20000000,60000000,6.92592,7.0,114
Vampires Suck,Some sagas just won't die.,2010-08-18,82.0,20000000,80547866,17.165039,4.2,315
This Is Where I Leave You,Welcome Home. Get Uncomfortable.,2014-09-10,103.0,19800000,41296320,20.311684,6.5,505
Doubt,"There is no evidence. There are no witnesses. But for one, there is no doubt.",2008-11-27,104.0,20000000,50907234,20.975165,7.0,435
Team America: World Police,Putting The 'F' back in 'Freedom',2004-10-10,98.0,32000000,50907422,26.509175,6.6,660
Paint Your Wagon,Stake Your Claim To The Musical Goldmine of '69!,1969-10-15,158.0,20000000,31678778,7.9025360000000004,6.2,63
Milk,Never Blend In.,2008-11-26,128.0,20000000,54586584,30.909699,7.1,612
Risen,Witness the manhunt that changed the course of human history,2016-02-19,107.0,20000000,46069568,16.663797,5.7,295
Ghost Ship,Sea Evil,2002-10-25,91.0,35000000,68349884,27.724913,5.3,531
A Very Harold & Kumar Christmas,Christmas comes prematurely.,2011-11-04,108.0,19000000,35387212,17.971883,6.0,328
Wild Things,They're dying to play with you.,1998-03-20,108.0,20000000,67200000,25.041992,6.3,444
The Debt,Every secret comes with a price.,2010-04-11,113.0,20000000,45636368,14.857884,6.3,257
High Fidelity,"A comedy about fear of commitment, hating your job, falling in love and other pop favorites.",2000-03-17,113.0,30000000,47126295,23.982956,7.0,628
Eye for an Eye,What do you do when justice fails?,1996-01-12,101.0,20000000,0,3.9963919999999997,5.8,63
The World's End,Good food. Fine ales. Total Annihilation.,2013-07-18,109.0,20000000,46089287,55.964605000000006,6.7,1778
Nancy Drew,Small Town Girl. Big Time Adventure.,2007-06-15,99.0,0,0,5.0348,5.8,143
Daybreakers,"In 2019, The Most Precious Natural Resource... Is Us.",2009-01-06,98.0,20000000,51416464,28.019226,6.0,634
Stay Alive,You die in the game - you die for real.,2006-03-24,100.0,9000000,27105095,4.34503,5.3,155
Quigley Down Under,There's a price on his head. A girl on his mind. And a twinkle in his eye.,1990-10-17,119.0,0,0,11.360997,6.5,119
Alpha and Omega,A Pawsome 3D Adventure,2010-09-17,88.0,20000000,39300000,12.300789,5.3,124
Stick It,The world of competitive gymnastics is about to be turned on its head.,2006-04-21,105.0,0,0,9.750557,6.3,148
Nerve,Are you a watcher or a player?,2016-07-27,96.0,20000000,83707310,62.933899,7.1,2181
Vampires,From the Master of Evil. Comes a New Breed of Terror,1998-04-15,108.0,20000000,0,17.016284,5.8,255
My Best Friend's Girl,It's funny what love can make you do...,2008-09-19,101.0,20000000,36620508,17.145287,5.4,220
Endless Love,Say Goodbye to Innocence,2014-02-12,103.0,20000000,34077920,27.256849,6.7,542
Ladyhawke,No force in Heaven will release them. No power on Earth can save them.,1985-03-27,121.0,20000000,18432000,14.370110999999998,6.8,260
Simon Birch,Destiny has big plans for little Simon Birch.,1998-09-11,114.0,20000000,18253415,11.090254,6.5,52
Reign Over Me,Let in the unexpected.,2007-03-23,124.0,20000000,22222308,20.827779999999997,7.1,334
Into the Wild,Into the heart. Into the soul.,2007-09-11,148.0,15000000,56255142,43.644978,7.8,3045
School for Scoundrels,Life's A Game. Learn How To Play.,2006-09-29,100.0,20000000,17807569,8.244324,5.6,111
Silent Hill: Revelation 3D,This Halloween prepare for a 3D ride through hell.,2012-10-10,94.0,20000000,52302796,23.292761,5.0,432
Pooh's Heffalump Movie,There's something new in the Hundred Acre Wood.,2005-02-11,68.0,0,0,9.03154,6.4,88
The Country Bears,It's A Bear Getting The Family Together!,2002-07-26,88.0,35000000,0,6.908351,4.3,20
Paparazzi,One good shot deserves another.,2004-09-03,84.0,20000000,16605763,9.149089,5.8,52
Secret in Their Eyes,The truth lies in the most unexpected places.,2015-10-14,111.0,19500000,34854990,15.012236999999999,6.2,336
Armored,Who will be the last man standing?,2009-12-04,88.0,20000000,22942221,15.21229,5.5,208
The Man Who Knew Too Little,"He’s on a mission so secret, even he doesn’t know about it.",1997-11-14,97.0,20000000,13801755,6.397042,6.5,125
What's Your Number?,Ally's looking for the best ex of her life.,2011-09-30,106.0,20000000,30426096,19.220789,6.2,671
Lockout,Take no prisoners.,2012-04-12,95.0,20000000,32204030,35.232278,5.8,715
Envy,"Success didn’t go to his head, it went to his neighbor.",2004-04-30,99.0,40000000,0,9.842771,4.8,139
Bullets Over Broadway,,1994-10-14,98.0,0,0,7.829295,7.0,130
One Night with the King,Feel The Touch Of Destiny,2006-10-13,123.0,20000000,13391174,3.476925,6.1,12
The Quiet American,,2002-11-22,101.0,30000000,27674124,5.133744,6.4,81
The Weather Man,Dave Spritz is about to take his best shot . . . at life,2005-10-20,101.0,20000000,12482775,14.031376999999999,6.0,289
Undisputed,Two Enemies ... The Mob ... The Ultimate Showdown.,2002-08-23,96.0,20000000,12398628,17.227376,6.1,139
Ghost Town,He sees dead people... and they annoy him.,2008-09-19,102.0,0,0,17.98817,6.4,286
12 Rounds,Survive all 12,2009-03-19,108.0,20000000,17280326,15.66135,5.7,220
Let Me In,Innocence dies. Abby doesn't.,2010-10-01,116.0,20000000,24145613,19.705311,6.7,641
3 Ninjas Kick Back,"Colt, Rocky and Tum Tum are back for bigger kicks in an all new adventure",1994-05-06,93.0,0,0,2.645722,4.5,48
Be Kind Rewind,"You name it, we shoot it.",2008-01-20,102.0,0,0,17.662682999999998,6.2,424
Triple 9,The Code on the Street is Never Black & White,2016-02-19,115.0,20000000,12639297,29.371987,5.6,797
Burnt,Never underestimate a man with everything to lose.,2015-10-02,100.0,20000000,36606743,30.477114,6.3,950
Everyone Says I Love You,,1996-12-06,101.0,20000000,0,12.379781,6.5,147
Death Sentence,Protect what's yours.,2007-08-31,105.0,20000000,16974459,12.643703,6.5,297
Everybody's Fine,Frank's travelling light but carrying excess baggage.,2009-12-04,99.0,21000000,0,15.440465,6.5,284
The Man,One guy walks the walk. The other talks and talks.,2005-09-08,83.0,0,12382362,6.925644999999999,5.4,133
Code Name: The Cleaner,,2007-01-05,84.0,20000000,10337477,9.361460000000001,4.7,78
Connie and Carla,"When you follow your dream, there's no telling what you'll become.",2004-04-16,98.0,20000000,11341016,6.102663,6.4,24
An American Carol,Laugh like you're country depends on it.,2008-10-03,83.0,20000000,7000000,2.6053740000000003,4.1,20
Machete Kills,Trained to kill. Left for dead. Back for more.,2013-09-12,107.0,12000000,15008161,29.072964000000002,5.3,631
Strange Wilderness,This ain't March of the Penguins.,2008-02-01,87.0,0,6575282,4.9613059999999995,4.7,69
A Dangerous Method,Why deny what you desire the most.,2011-09-30,99.0,15000000,27462041,27.133277000000003,6.2,571
A Scanner Darkly,Everything Is Not Going To Be OK,2006-05-25,100.0,8700000,7659918,26.093042999999998,6.8,532
Alone in the Dark,Can mankind defeat the army of darkness unleashed by an ancient evil cult?,2005-01-28,96.0,20000000,10442808,9.292987,3.1,173
Birth,Be careful what you wish for.,2004-09-08,100.0,20000000,0,7.698075,5.9,179
Passchendaele,,2008-10-17,114.0,0,0,2.405911,6.3,26
Flash of Genius,"Corporations have time, money, and power on their side. All Bob Kearns had was the truth.",2008-09-07,119.0,0,0,3.3502970000000003,6.3,59
The Brothers Bloom,They'd never let the truth come between them.,2008-09-09,114.0,20000000,5530764,10.218307000000001,6.8,203
Princess Mononoke,The Fate Of The World Rests On The Courage Of One Warrior.,1997-07-12,134.0,26500000,159375308,60.732738,8.2,1983
Can't Stop the Music,The Musical Comedy Smash of the 80's!,1980-06-20,124.0,0,0,6.574285000000001,4.9,9
The Proposition,This land will be civilized.,2005-10-06,104.0,2000000,5048693,14.617944,7.1,218
Marci X,Uptown Gets Down.,2003-08-22,84.0,20000000,1675706,5.65327,3.3,12
The Oogieloves in the Big Balloon Adventure,,2012-08-29,88.0,0,0,0.28576,2.2,8
By the Sea,,2015-11-12,122.0,10000000,3727746,11.267676,5.4,156
The Visitors II: The Corridors of Time,They come back!,1998-02-11,118.0,0,0,12.283025,5.8,221
The Tempest,,2010-12-10,110.0,20000000,346594,3.620537,6.0,31
Regression,Fear always finds its victim,2015-10-01,106.0,0,17671101,27.215666,5.3,585
Three Kingdoms: Resurrection of the Dragon,,2008-04-03,102.0,0,0,4.127155,6.6,35
Ramanujan,,2014-07-11,170.0,0,0,0.416179,5.0,3
Hands of Stone,No más. No surrender.,2016-08-26,105.0,20000000,0,7.444189,6.1,109
The Painted Veil,Sometimes the greatest journey is the distance between two people.,2006-12-09,125.0,19400000,0,20.746932,7.1,312
The Baader Meinhof Complex,,2008-09-24,150.0,27000000,0,7.727035000000001,7.1,157
Dances with Wolves,Inside everyone is a frontier waiting to be discovered.,1990-11-09,181.0,22000000,424208848,45.707834999999996,7.6,1046
A Cinderella Story,Once upon a time... can happen any time.,2004-07-10,95.0,19000000,70067909,25.28132,6.1,713
Thir13en Ghosts,"There are ghosts around us all the time. Most of them don't want to hurt us. But, there are exceptions...",2001-10-26,91.0,0,0,20.392858,5.4,440
Back to the Future,He's the only kid ever to get into trouble before he was born.,1985-07-03,116.0,19000000,381109762,76.60323299999999,8.0,6079
I Can Do Bad All By Myself,,2009-09-11,113.0,0,0,2.242809,6.0,40
Fight Valley,One way in. No way out.,2016-07-22,90.0,27000000,0,1.224105,3.9,8
The Switch,The most unexpected comedy ever conceived.,2010-05-11,101.0,19000000,49830607,27.494037,5.9,583
The Crazies,Fear Thy Neighbor,2010-02-26,101.0,20000000,54956140,28.867568,6.2,633
Firestorm,,2013-12-12,110.0,0,0,3.3769669999999996,5.9,43
The Bounty,"After 200 years, the truth behind the legend.",1984-05-04,132.0,25000000,8613462,7.436491,6.5,108
Take Me Home Tonight,Best. Night. Ever.,2011-03-04,97.0,19000000,6928068,11.766564,6.2,208
Won't Back Down,If you can't beat the system... change it,2012-09-28,121.0,0,5310554,2.3662509999999997,5.8,40
Kansas City,"Kansas City, 1934. Anything could happen here. One night it did.",1996-08-16,116.0,18000000,0,5.380733,6.1,12
Adaptation.,"From the creator of Being John Malkovich, comes the story about the creator of Being John Malkovich.",2002-12-06,114.0,19000000,32801173,26.441669,7.3,638
The Invention of Lying,In a world where everyone can only tell the truth... This guy can lie.,2009-09-13,100.0,18500000,31912793,16.665841,6.0,518
Star Trek III: The Search for Spock,A dying planet. A fight for life.,1984-05-31,105.0,18000000,87000000,15.314027,6.4,434
The Exorcism of Emily Rose,What happened to Emily?,2005-09-09,122.0,19000000,144216468,32.602868,6.3,659
Deuce Bigalow: Male Gigolo,He charges $10 but he’s willing to negotiate.,1999-12-10,88.0,17000000,65535067,9.832326,5.5,308
The Family Stone,Feel The Love,2005-12-14,103.0,0,0,14.190837,6.2,249
Bad Santa,He doesn't care if you're naughty or nice.,2003-11-26,91.0,23000000,76488889,26.588729999999998,6.5,656
Austin Powers: International Man of Mystery,"If he were any cooler, he'd still be frozen, baby!",1997-05-02,94.0,16500000,67683989,36.15716,6.5,1013
Predator,"If it bleeds, we can kill it...",1987-06-11,107.0,18000000,98235548,50.009408,7.3,2093
Prom Night,A Night To Die For.,2008-04-10,88.0,0,14796236,9.642041,4.8,167
Gosford Park,Tea at four. Dinner at eight. Murder at midnight.,2001-11-07,137.0,19800000,87754044,11.693272,6.8,246
Birdman,or (The Unexpected Virtue of Ignorance),2014-08-27,119.0,18000000,103215094,89.811154,7.4,4535
Blue Jasmine,Blue Moon. I used to know the words. Now they're all a jumble.,2013-07-25,98.0,18000000,99206215,34.694216,7.0,1098
The Fog,Lock your doors. Bolt your windows. There's something in THE FOG!,1980-02-08,89.0,1000000,21378361,14.518598,6.4,311
Soul Surfer,"When you come back from a loss, beat the odds, and never say never, you find a champion.",2011-04-08,106.0,18000000,47088990,19.234672,6.9,342
Observe and Report,"Right now, the world needs a hero.",2009-04-10,86.0,0,24007324,10.529143,5.6,225
Raging Bull,,1980-11-14,129.0,18000000,23000000,35.524457,7.7,938
Young Sherlock Holmes,"Before a lifetime of adventure, they lived the adventure of a lifetime.",1985-12-04,109.0,18000000,0,8.321586,6.7,167
Small Time Crooks,They took a bite out of crime,2000-05-19,94.0,0,0,11.423533,6.4,155
Love the Coopers,"Christmas means comfort, joy and chaos.",2015-11-12,107.0,17000000,24000000,9.191187,5.4,167
Steve Jobs,Can a great man be a good man?,2015-10-09,122.0,30000000,34441873,53.670525,6.8,1573
And So It Goes,,2014-07-20,94.0,18000000,25312387,9.633711,5.7,164
Troop Beverly Hills,"When the going gets tough, the tough go shopping!",1989-03-22,105.0,0,0,3.455018,5.6,56
Dragonslayer,"In the Dark Ages, Magic was a weapon. Love was a mystery. Adventure was everywhere... And Dragons were real.",1981-06-26,108.0,18000000,14110013,3.258422,6.5,67
