title,tagline,release_date,runtime,budget,revenue,popularity,vote_average,vote_count
Veer-Zaara,A Love Legend,2004-11-12,192.0,7000000,29385320,3.721858,7.4,64
Cyrus,John met the woman of his dreams. Then he met her son ...,2010-06-18,91.0,7000000,0,15.212569,6.1,133
A Dog Of Flanders,,1999-08-27,96.0,0,0,0.838938,6.4,6
Auto Focus,A day without sex is a day wasted.,2002-10-18,104.0,7000000,2062066,7.051521000000001,6.1,56
We Need to Talk About Kevin,,2011-09-28,112.0,7000000,6038942,21.276864,7.4,677
Mother and Child,,2009-11-07,125.0,7000000,0,5.517597,6.7,46
March or Die,,1977-09-08,107.0,0,0,3.829937,6.2,16
Somewhere,,2010-09-03,98.0,8000000,0,9.590373,6.0,208
Dom Hemingway,I want my money plus interest.... and a present,2013-11-15,93.0,0,523511,10.416332,5.8,212
Gerry,,2002-01-12,103.0,3500000,0,5.038953,6.2,68
The Extra Man,"They're not gigolos, they're gentlemen.",2010-08-01,108.0,7000000,453079,2.26778,5.9,29
Ca$h,,2010-01-01,108.0,7000000,46488,8.207425,6.0,73
Wah-Wah,Every family has its own language,2005-08-17,120.0,0,0,2.356244,6.3,8
The Boondock Saints,Thy Kingdom Come. Thy Will Be Done.,1999-01-22,108.0,6000000,30471,34.917446999999996,7.2,837
Z Storm,,2014-06-19,92.0,0,0,0.542814,5.8,5
Twixt,"Between the living and the dead, eviil is waiting.",2011-09-10,84.0,7000000,0,5.060656,5.0,85
The Snow Queen,"Cold can freeze your heart, love can set you free",2012-10-11,76.0,7000000,12400000,5.33861,5.1,47
Pale Rider,... and hell followed with him.,1985-06-28,115.0,0,41410568,14.574995000000001,7.0,251
Stargate: The Ark of Truth,The lines have been drawn. The battle has been waged. Only one thing can save us...,2008-03-11,97.0,7000000,8900000,8.591387,6.9,140
Two Lovers and a Bear,,2016-10-02,96.0,0,0,3.139294,6.8,27
Aimee & Jaguar,,1999-02-10,125.0,0,0,2.8326279999999997,6.3,20
Shade,"Lie, cheat, steal... your deal!",2003-05-18,101.0,6800000,0,4.665309,6.1,73
Incendies,The search began at the opening of their mother's will.,2010-09-04,130.0,6800000,7103838,21.285206,7.9,479
Elite Squad,On the streets of Rio only the elite survive,2007-10-12,115.0,4000000,0,23.604936,7.8,504
Bran Nue Dae,Bran Nue Dae,2009-08-09,82.0,7,7,0.050456,5.2,6
La Bamba,Born into poverty. Destined for stardom. He lived the American dream.,1987-07-24,108.0,6500000,54215416,6.847099000000001,6.8,116
Friends with Money,,2006-09-07,88.0,6500000,13368437,11.885221000000001,5.1,128
The Andromeda Strain,The picture runs 130 minutes!... The story covers 96 of the most critical hours in man's history!... The suspense will last through your lifetime!,1971-03-12,131.0,6500000,12376563,12.524953,7.0,190
Bats,They will suck you dry,1999-10-22,91.0,0,10,1.537859,4.1,35
Nowhere in Africa,One family's tale of a homeland lost... and a homeland found.,2001-12-11,140.0,0,0,3.4815169999999998,7.0,32
Layer Cake,,2004-09-30,105.0,6500000,11850214,24.0034,7.0,559
The Work and the Glory II: American Zion,,2005-10-21,100.0,6500000,2025032,2.639106,8.0,6
The East,"Spy on us, we'll spy on you.",2013-05-31,116.0,6500000,2401510,16.574756,6.5,305
Aberdeen,,2000-07-05,113.0,0,0,1.068819,7.0,6
The Messenger,The Scars of War Will Last Forever,2009-11-13,113.0,6500000,1521261,8.432400999999999,7.1,119
Tracker,,2010-05-20,102.0,6500000,0,2.074295,6.0,16
Control,,2007-09-26,121.0,0,8159508,11.357474,7.5,200
Grease,Grease is the word,1978-07-07,110.0,6000000,181813770,67.608041,7.2,1581
Mary Poppins,It's supercalifragilisticexpialidocious!,1964-08-27,139.0,6000000,102272727,59.961523,7.4,1183
Ordinary People,Everything is in its proper place...except the past.,1980-09-19,124.0,6000000,0,12.541983,7.4,145
Caddyshack,The snobs against the slobs!,1980-07-25,98.0,6000000,39846344,15.929648,6.6,365
The Brothers,,2001-03-23,106.0,0,0,3.029944,6.5,10
The Wood,From best friends to best men.,1999-07-16,106.0,6000000,25059640,5.537646,7.1,34
The Usual Suspects,Five Criminals. One Line Up. No Coincidence.,1995-07-19,106.0,6000000,23341568,64.02503100000001,8.1,3254
A Nightmare on Elm Street 5: The Dream Child,"Now Freddy’s a daddy, he’s killing for two.",1989-08-11,89.0,8000000,22168359,12.654050999999999,5.5,245
The Wrestler,Love. Pain. Glory.,2008-09-07,109.0,6000000,44703995,40.196514,7.3,1000
Duel in the Sun,Emotions . . . As Violent As The Wind-Swept Prairie !,1946-12-31,144.0,6000000,20400000,7.60445,6.2,37
Escape from New York,1997. New York City is now a maximum security prison. Breaking out is impossible. Breaking in is insane.,1981-05-22,99.0,6000000,50244700,24.351305,6.9,703
Daddy Day Camp,The summer is going to be in tents.,2007-08-08,89.0,6000000,18197398,12.601677,4.4,91
A Mighty Wind,"Back together for the first time, again.",2003-04-16,91.0,6000000,18750246,4.053017,6.6,74
Mystic Pizza,A Romantic Comedy With The Works,1988-10-13,104.0,0,0,6.379933,5.9,123
Tales from the Hood,Chill or be Chilled,1995-05-24,98.0,6000000,12000000,3.89204,5.4,32
The Last King of Scotland,Charming. Magnetic. Murderous.,2006-09-01,121.0,6000000,48027970,26.286953999999998,7.4,558
City Island,Truth is stranger than family,2009-03-06,104.0,6000000,6670712,6.497285,6.9,113
The Guard,The FBI are about to discover that things work a little differently around here.,2011-07-07,96.0,6000000,19560274,19.411141,6.8,372
College,,2008-08-28,94.0,7000000,6230276,7.034617999999999,4.8,48
Little Voice,Finding your own voice can be magic.,1998-11-05,97.0,0,0,4.647547,6.6,61
Simply Irresistible,Magic opened up their hearts... Love did the rest.,1999-02-05,95.0,6000000,4398989,5.696491,5.5,52
Only the Strong,The ultimate martial art.,1993-08-27,99.0,6000000,3283371,5.411243,6.9,29
Shattered Glass,,2003-11-14,94.0,6000000,2944752,6.27257,6.6,111
Novocaine,,2001-11-23,95.0,6000000,2025238,4.1482529999999995,6.0,44
The Wild Bunch,"If you only want to spend two hours in a movie theatre and go home and forget it, stay away from THE WILD BUNCH.",1969-06-17,145.0,6244087,638641,14.970654000000001,7.6,259
The Wackness,,2008-07-03,99.0,6000000,2899975,7.161051,6.2,94
The 5th Quarter,Rising from tragedy to triumph,2011-03-25,97.0,6000000,399611,0.215464,4.7,12
The Flower of Evil,,2003-02-09,104.0,0,0,1.229667,5.7,10
The Greatest,,2009-01-17,99.0,6000000,0,6.903186,6.2,34
Come Early Morning,"Before you fall in love, you need to love yourself.",2006-01-10,97.0,6000000,0,3.427061,5.9,10
Men of War,"Killers for hire are paid for what they can do, not for what they believe... until today.",1994-09-04,103.0,0,0,1.734764,5.4,29
Deadfall,Twisty thriller... a wild ride.,2012-11-08,95.0,12000000,66351,10.19041,5.6,224
The Hit List,Who's on your list?,2011-04-02,90.0,6000000,0,4.957014,5.2,73
Emma,,2009-10-11,240.0,0,0,2.1356889999999997,7.6,38
Videodrome,First it controls your mind. Then it destroys your body.,1983-02-04,87.0,5952000,2120439,18.119265,7.1,454
Freaky Deaky,Crime is such a trippy thing,2012-04-22,90.0,0,0,4.448353,4.9,18
Trade Of Innocents,Justice needs a hero,2012-09-27,91.0,0,0,2.204138,5.5,12
Stiff Upper Lips,,1998-06-12,99.0,0,0,0.356495,10.0,1
Bend It Like Beckham,"Sometimes, to follow your dreams... you've got to bend the rules!",2002-04-11,112.0,3500159,76578641,22.054546,6.2,578
Sunshine State,Greetings from ...,2002-06-21,141.0,0,0,4.245123,6.0,10
[REC]²,Fear Revisited,2009-09-15,85.0,5600000,18469680,22.341462,6.4,489
Chariots of Fire,"This is the story of two men who run, not to run, but to prove something to the world. They will sacrifice anything to achieve their goals... except their honor.",1981-05-15,123.0,5500000,58972904,10.439971,6.8,207
Diary of a Mad Black Woman,Time heals the heart. Faith heals the rest.,2005-02-25,116.0,0,0,3.784535,6.4,71
Don Jon,Everyone loves a happy ending.,2013-07-26,90.0,6000000,0,33.296684,5.9,1671
Iris,,2001-12-14,91.0,0,0,2.714043,6.2,47
The Chorus,,2004-03-17,96.0,0,0,20.982454999999998,7.5,526
Mambo Italiano,Things change. Family doesn't.,2003-06-06,92.0,4361898,3031801,2.080741,5.6,28
Wonderland,"Sex, drugs, murder. Welcome to L.A.",2003-10-23,104.0,5000000,2466444,7.79068,6.2,73
Do the Right Thing,"It's the hottest day of the summer. You can do nothing, you can do something, or you can...",1989-06-30,120.0,6500000,37295445,15.580335,7.6,292
Harvard Man,"Passion, Seduction, Deception.",2001-01-01,99.0,0,0,5.336243,4.8,15
Le Havre,,2011-05-17,93.0,3850000,0,10.787322,6.8,97
R100,M For Father,2013-10-05,100.0,5500000,0,3.21392,5.4,31
Rang De Basanti,A Generation Awakens,2006-01-26,157.0,2200000,11502151,5.206967,7.2,97
Animals,,2014-05-15,90.0,0,0,1.5846,6.2,9
Salvation Boulevard,Faith alone doesn’t cut it anymore,2011-07-15,96.0,8000000,0,3.6533050000000005,5.6,28
Saint Ralph,He's hoping for a miracle. He doesn't have a prayer.,2004-09-11,95.0,0,0,1.688495,7.3,24
Miss Julie,Love is a foolish game,2014-09-07,120.0,5500000,5000000,5.033065000000001,5.9,45
Somewhere in Time,Beyond fantasy. Beyond obsession. Beyond time itself... he will find her.,1980-10-02,103.0,5100000,0,5.934016000000001,7.2,102
Saw II,Oh Yes... There Will Be Blood.,2005-10-28,92.0,4000000,152925093,42.187985999999995,6.3,1251
10 Cloverfield Lane,Monsters come in many forms.,2016-03-10,103.0,15000000,108286421,53.698682999999996,6.8,2468
Paranormal Activity 3,It Runs In The Family,2011-10-19,83.0,5000000,205703818,29.15813,5.9,669
Ouija,Keep telling yourself it's just a game,2014-10-24,89.0,5000000,103590271,56.30466,4.9,983
Paranormal Activity 4,It's closer than you think,2012-10-17,95.0,5000000,142817992,20.326337,5.2,563
The Return of the Pink Panther,,1975-05-21,113.0,5000000,41833347,6.470766,6.7,137
"20,000 Leagues Under the Sea",The mightiest motion picture of them all!,1954-12-23,127.0,5000000,28200000,9.358197,6.8,157
The Elephant Man,I am not an animal! I am a human being! I... am... a man!,1980-10-02,124.0,5000000,26010864,30.271065999999998,7.9,719
House Party 2,,1991-10-23,94.0,0,0,3.6735660000000006,4.7,21
The Man from Snowy River,The story of a boy suddenly alone in the world. The men who challenge him. And the girl who helps him become a man.,1982-03-02,104.0,3500000,20659423,3.6564910000000004,6.8,37
Doug's 1st Movie,You'll Dig Doug!,1999-03-26,77.0,0,0,1.88484,5.4,22
The Apostle,The hardest soul to save was his own.,1997-10-09,134.0,5000000,0,4.227807,6.1,38
Mommie Dearest,The meanest mother of them all,1981-09-18,129.0,0,0,3.102862,6.5,54
The Egyptian,"To Nefer, shameless temptress of Babylon, he surrendered his parents' hope of immortality!",1954-08-25,139.0,5000000,15000000,4.079111,6.0,11
Nighthawks,A terrorist holds New York in a grip of fear - and only Stallone can take him on.,1981-03-17,99.0,5000000,19905359,7.0588679999999995,6.4,86
Friday the 13th Part VIII: Jason Takes Manhattan,The Big Apple's in BIG trouble!,1989-07-28,100.0,5000000,14000000,12.904615,4.8,191
Spring Breakers,A little sun can bring out your dark side.,2013-01-24,94.0,5000000,31724284,62.554173,5.0,1551
Shaun of the Dead,A romantic comedy. With zombies.,2004-04-09,99.0,4000000,30039392,49.12486,7.5,2420
Apollo 18,There's a reason we've never gone back to the moon.,2011-07-20,86.0,5000000,25562924,17.028252,5.0,356
No Escape,No rescue. No refuge.,2015-08-26,103.0,5000000,54418872,38.006982,6.7,777
The Beastmaster,"Born with the courage of an eagle, the strength of a black tiger, and the power of a god.",1982-08-20,118.0,0,14056528,6.377523,6.0,97
Solomon and Sheba,Only once in 3000 years...anything like...,1959-12-25,139.0,5000000,12200000,0.835617,5.4,8
Fifty Shades of Black,Way shadier than gray.,2016-01-28,92.0,20000000,21164799,14.947588,4.3,331
Not Easily Broken,,2009-01-09,99.0,0,0,5.1299,6.3,9
The Perfect Match,t's what everyone's looking for,2016-03-11,96.0,0,0,3.8108269999999997,5.2,42
Saved!,,2004-01-21,92.0,0,0,9.851230000000001,6.3,147
UHF,"A lot of TV stations have forgotten what ""quality"" means, but not Channel 62. They NEVER knew what it meant.",1989-07-21,97.0,5000000,0,4.070044,6.7,89
Grandma's Boy,A movie that proves you're never too old to come of age.,2006-01-06,94.0,0,6538177,9.974681,6.6,220
Slums of Beverly Hills,Growing Up is Hard to Do,1998-08-14,91.0,5000000,0,6.308298000000001,6.5,44
Once Upon a Time in the West,There were three men in her life. One to take her... one to love her... and one to kill her.,1968-12-21,175.0,5000000,5321508,49.333137,8.1,1128
Made,Welcome to disorganized crime.,2001-07-13,94.0,5000000,5476060,4.149628,6.3,55
Keeping Up with the Steins,A 13-year-old boy uses his upcoming bar mitzvah to reconcile the strained relationship between his father and grandfather.,2006-05-12,90.0,0,0,3.562563,5.2,18
Sea Rex 3D: Journey to a Prehistoric World,The T-Rex of the Seas come alive.,2010-05-14,41.0,5000000,4074023,4.498368,5.9,11
The Sweet Hereafter,There is no such thing as the simple truth.,1997-05-14,112.0,5000000,3263585,7.6731240000000005,6.8,103
Of Gods and Men,"In the face of terror, their greatest weapon was faith...",2010-05-18,120.0,4000000,41424067,4.992475,6.5,91
90 Minutes in Heaven,Hope lives,2015-09-11,121.0,5000000,4842699,3.9437059999999997,5.4,40
Everything Must Go,Lost is a good place to find yourself,2010-10-15,97.0,5000000,2614773,9.169411,6.0,208
Zero Effect,The world's most private detective.,1998-01-30,116.0,5000000,1980338,2.732031,6.0,55
Light Sleeper,He was a good man in a deadly business. She was his only way out.,1992-08-21,103.0,5000000,0,6.063868,5.7,15
Kill the Messenger,Can you keep a national secret?,2014-10-09,112.0,5000000,2450846,21.343093,6.6,355
Rabbit Hole,The only way out is through.,2010-12-16,91.0,5000000,5129058,10.095184,6.9,165
Party Monster,'Til death do they party...,2003-09-05,98.0,5000000,742898,4.129165,5.9,58
Green Room,One way in. No way out.,2016-04-15,95.0,5000000,3220371,30.001023999999997,6.7,683
The Oh in Ohio,One woman's story is about to climax.,2006-03-30,88.0,5000000,0,6.759235,5.8,27
Bottle Rocket,"They're not really criminals, but everyone's got to have a dream.",1996-02-21,91.0,7000000,560069,11.700578,6.8,281
Out of the Blue,A harrowing drama from the director of Easy Rider,1980-05-01,94.0,0,0,0.679351,6.5,17
"Lovely, Still","Something mysterious, new, unexpected and lovely is happening to Robert Malone.",2008-01-01,92.0,0,0,1.286991,6.2,13
Redacted,,2007-01-01,90.0,5000000,782102,3.792015,6.2,37
Sleep Tight,Someone is watching over you,2011-10-14,107.0,5000000,0,9.136965,7.0,202
The Cottage,Sleeps Six Bloody Comfortably,2008-02-07,92.0,0,0,8.39685,6.3,80
Rudderless,The way back begins with a single chord.,2014-10-17,105.0,5000000,0,10.619574,7.4,105
Henry & Me,,2014-08-18,67.0,5000000,0,0.999655,3.0,3
Christmas Eve,They'll be home for Christmas...if only in their dreams.,2015-12-04,95.0,0,0,1.985243,6.1,24
Should've Been Romeo,Even Shakespeare didn't see this one coming.,2012-04-28,0.0,0,0,0.40703,0.0,0
Running Forever,,2015-10-27,88.0,0,0,0.028756,0.0,0
I Served the King of England,,2006-12-19,120.0,0,0,2.387463,7.0,22
Soul Kitchen,,2009-09-09,99.0,5000000,17872796,5.461487,7.1,116
Sling Blade,A simple man. A difficult choice.,1996-08-30,135.0,1000000,24475416,14.805264000000001,7.4,231
The Awakening,Sometimes dead does not mean gone.,2011-08-17,107.0,4798235,209696,25.30216,6.3,458
Hostel,Welcome To Your Worst Nightmare,2005-01-06,94.0,4800000,80578934,38.831920000000004,5.7,887
A Cock and Bull Story,Because everyone loves an accurate period piece.,2005-07-17,94.0,0,0,3.5007410000000005,6.2,43
Lady in White,"The year is 1962. The place is Willowpoint Falls. Nobody talks about what happened in the school cloakroom 10 years ago. Now, in the dead of night, Frankie Scarlatti is going to find out why.",1988-04-22,112.0,0,0,1.435742,6.3,25
Driving Lessons,,2006-04-30,98.0,0,0,7.6678880000000005,6.3,47
Only God Forgives,Time to Meet The Devil,2013-05-30,90.0,4800000,10337387,35.754865,5.6,862
Camping Sauvage,,2005-10-13,80.0,0,0,0.20323,4.8,4
Dear Frankie,,2004-05-18,105.0,0,0,3.1131900000000003,7.0,46
All Hat,,2007-09-11,89.0,0,0,0.137535,1.0,1
Treading Water,Mica is a perfectly normal boy. Well he would be if he didn't smell of fish.,2013-09-13,92.0,4700000,0,0.217538,5.6,6
Savage Grace,Truth is more shocking than fiction.,2007-05-18,97.0,4600000,0,3.5318769999999997,5.7,60
The Blue Lagoon,A sensuous story of natural love.,1980-07-05,104.0,4500000,58853106,22.585384,5.8,408
Four Weddings and a Funeral,Five good reasons to stay single.,1994-03-09,117.0,6000000,254700832,29.834065000000002,6.6,632
Fast Times at Ridgemont High,"Fast Cars, Fast Girls, Fast Carrots...Fast Carrots?",1982-08-13,90.0,4500000,27092880,20.403344,7.0,322
Moby Dick,"From the immortal adventure classic...of whaling men, their ships, and the sea!",1956-06-27,116.0,4500000,10400000,5.224593,6.9,89
Requiem for a Dream,,2000-10-27,102.0,4500000,7390108,11.573034,7.9,2443
Tango,Tango: do not ever leave me,1998-02-12,115.0,0,0,0.425551,6.8,6
Moms' Night Out,What could go wrong?,2014-03-25,98.0,5000000,10429707,10.274542,5.5,121
Donnie Darko,You can never go too far,2001-01-18,113.0,6000000,1270522,61.210016,7.7,3452
Life During Wartime,,2009-10-10,97.0,4500000,744816,3.1088810000000002,6.3,30
Sympathy for Lady Vengeance,All she wanted was a peaceful life... they didn't give it.,2005-07-29,115.0,0,23803308,17.074842999999998,7.4,356
Mean Machine,"It's Not Just About Football, It's About Pride Inside!",2001-12-26,99.0,0,0,8.816995,6.0,157
Exiled,,2006-09-06,110.0,4500000,0,8.48639,7.0,46
Blackthorn,No destiny,2011-08-31,98.0,0,623528,5.223096,6.6,73
Lilya 4-ever,,2002-08-23,109.0,0,0,7.759214999999999,7.7,139
After.Life,Life is the symptom. Death is the cure.,2010-04-09,104.0,4500000,3606395,14.570359,5.4,251
Fugly,,2014-06-13,134.0,0,0,0.371337,5.3,2
Silent Movie,,1976-06-17,86.0,0,0,7.3159350000000005,6.7,78
Anne of Green Gables,,1985-12-01,199.0,0,0,8.772574,8.2,68
Falcon Rising,,2014-09-05,103.0,0,0,6.988357000000001,5.5,71
The Sweeney,Act like a criminal to catch a criminal.,2012-09-11,112.0,3730500,6294161,6.938853999999999,5.7,109
Whale Rider,,2003-01-30,101.0,8000000,41400000,12.439494999999999,7.1,111
The Crying Game,Play At Your Own Risk.,1992-09-02,112.0,3705538,62548947,8.839651,6.9,176
Annie Hall,A nervous romance.,1977-04-19,93.0,4000000,38251425,35.892034,7.8,1010
The Greatest Show on Earth,,1952-01-10,152.0,4000000,36000000,8.988455,6.6,50
Monster's Ball,A lifetime of change can happen in a single moment.,2001-11-11,111.0,4000000,44909486,14.042041000000001,6.5,250
Hansel and Gretel Get Baked,,2013-02-19,86.0,4500000,0,2.503612,4.8,67
Trapeze,"High...High...High...Above Them All! - in excitement! - in spectacle! - in fire, flesh and fury!",1956-05-30,105.0,4000000,14400000,1.3793540000000002,6.4,22
The Kids Are All Right,"Nic and Jules had the perfect family, until they met the man who made it all possible.",2010-07-09,106.0,3500000,34705850,15.338211,6.5,506
They Live,Who are they? And what do they want?,1988-11-23,94.0,4000000,13008928,29.852608,7.1,550
What the #$*! Do We (K)now!?,Time to get wise.,2004-04-23,109.0,0,10000000,7.288352000000001,5.8,34
The Last Exorcism Part II,The second coming,2013-02-28,88.0,5000000,15179302,10.605752,4.4,203
Scoop,The perfect man. The perfect story. The perfect murder.,2006-07-27,96.0,4000000,31584901,17.229537,6.4,420
The Wash,"When you're down 'n dirty, it all comes out in...",2001-11-16,93.0,7000000,10229331,2.453459,5.3,26
3 Strikes,"the few, the proud, the paroled.",2000-03-01,82.0,6000000,9000000,1.433692,5.9,15
The Cooler,When your life depends on losing... the last thing you need is lady luck.,2003-01-17,101.0,32000000,0,9.976428,6.7,89
The Orphanage,A tale of love.  A story of horror.,2007-08-27,105.0,0,44000000,29.071955,7.1,633
A Haunted House 2,It'll scare the #2 out of you.,2014-04-17,87.0,0,0,18.428909,5.4,346
Topaz,Hitchcock takes you behind the actual headlines to expose the most explosive spy scandal of the century!,1969-12-18,143.0,4000000,6000000,5.975604,6.1,77
Let's Go to Prison,Welcome to the slammer,2006-11-17,84.0,4000000,4630045,4.598409999999999,5.5,69
Four Rooms,"Twelve outrageous guests. Four scandalous requests. And one lone bellhop, in his first day on the job, who's in for the wildest New year's Eve of his life.",1995-12-09,98.0,4000000,4300000,22.87623,6.5,530
The Real Cancun,,2003-04-23,96.0,0,0,0.45648500000000003,3.3,8
Waiting for Guffman,There's a good reason some talent remains undiscovered.,1996-01-31,84.0,0,0,4.348416,7.3,63
Red State,Fear God.,2011-08-19,88.0,4000000,1104682,12.062371,5.9,316
Mirrormask,The Other Side of Reason. The Other Side of Fate. The Other Side of Truth.,2005-01-25,101.0,4000000,866999,7.7581880000000005,6.6,102
Samsara,,2011-09-16,102.0,4000000,0,12.781972999999999,8.0,167
The Barbarians,Warriors. Conquerors. Heroes.,1987-03-01,87.0,0,0,1.631993,5.1,8
The Art of Getting By,The toughest lesson is love.,2011-06-17,83.0,0,1406224,12.690224,6.5,415
The Loss of Sexual Innocence,,1999-04-29,106.0,4000000,0,2.866934,5.2,9
Joe,,2014-04-11,118.0,4000000,2365467,22.987897,6.5,338
Shooting Fish,Fat cats are too easy. Go for the big fish.,1997-08-22,109.0,3000000,302204,1.204941,7.0,23
The Big Tease,He saw. He combed. He conquered.,1999-01-01,87.0,0,0,0.502396,5.8,6
"Guten Tag, Ramón",,2013-10-18,119.0,4000000,0,1.771584,8.1,18
Adore,,2013-04-03,100.0,16000000,318982,18.790221,6.1,291
The Velocity of Gary,*(Not His Real Name),1999-07-16,100.0,4000000,0,0.409089,4.2,5
Stake Land,The Most Dangerous Thing Is To Be Alive.,2010-09-30,98.0,650000,33245,12.496261,6.2,285
Futuro Beach,A hero split in half.,2014-05-01,106.0,0,0,2.611364,6.4,31
Another Happy Day,"At this wedding, the F-word stands for Family",2011-11-18,119.0,4000000,355688,3.238466,6.2,37
Hell's Angels,Howard Hughes' Thrilling Multi-Million Dollar Air Spectacle,1930-11-15,127.0,3950000,8000000,8.484123,6.1,19
The Helpers,Can we help you?,2012-10-27,78.0,4000000,0,1.390659,4.1,8
How to Fall in Love,,2012-07-21,0.0,4000000,0,1.923514,5.2,20
Network,Not since the dawn of time has America experienced a man like Howard Beale!,1976-11-01,121.0,3800000,23689877,17.234745,7.7,381
Desert Dancer,Be Brave. Be Bold. Be Free.,2014-07-03,98.0,0,0,1.972668,6.5,18
Major Dundee,,1965-04-07,123.0,3800000,14873,3.490215,6.2,38
The House of Sand,,2005-05-13,115.0,0,0,0.389471,6.7,9
Defendor,An unexpected hero will rise.,2009-09-12,101.0,3500000,44462,8.45342,6.5,195
The History Boys,History. It's just one bloody thing after another.,2006-10-02,109.0,4000000,13401952,3.7716519999999996,6.6,66
Chain of Command,"When duty calls, plans change",2015-08-30,88.0,5000000,0,1.398981,5.3,11
The Ballad of Cable Hogue,,1970-05-13,121.0,3716946,5000000,2.676535,6.9,47
In Cold Blood,,1967-12-14,134.0,3500000,13007551,7.821438000000001,7.4,82
The Witch,Evil takes many forms.,2016-02-19,92.0,3500000,40423945,50.319662,6.3,1434
The Secret in Their Eyes,,2009-08-13,129.0,2000000,33965843,25.894064999999998,7.8,626
Train,You're in for a hell of a ride.,2008-10-16,94.0,0,0,3.2800809999999996,4.8,36
Pootie Tang,Too cool for words.,2001-06-29,81.0,0,0,3.115754,5.4,43
Ira & Abby,"First comes love, then comes marriage, then comes therapy.",2006-01-01,104.0,0,0,0.595136,5.8,9
Winter Passing,Sometimes you go looking for something you want. . . and find what you need.,2006-02-07,98.0,3500000,113783,3.643608,6.7,28
The Masked Saint,,2016-01-08,111.0,0,0,0.909067,2.9,7
The Secret,,2016-04-29,200.0,0,0,0.042345999999999995,0.0,0
Wicked Blood,The Ultimate Endgame,2014-03-04,92.0,3500000,0,3.158056,5.3,37
Stranded,Revenge comes at a price.,2015-06-05,86.0,0,0,3.230779,5.0,11
High Anxiety,The Master of Comedy takes on The Master of Suspense!,1977-12-25,94.0,3400000,31063038,5.690619,6.5,84
March of the Penguins,"In the harshest place on Earth, love finds a way.",2005-01-26,80.0,8000000,127392239,17.537154,6.9,358
Choke,From the author of Fight Club,2008-09-26,92.0,3000000,3830137,11.637458,6.0,127
City of God,"If you run you're dead... if you stay, you're dead again. Period.",2002-02-05,130.0,3300000,30641770,44.356711,8.1,1814
Human Traffic,The Weekend has Landed!,1999-06-04,99.0,600000,4000000,4.859873,6.8,97
To Write Love on Her Arms,Based on the True Story that started a Global Movement.,2015-03-13,118.0,3400000,0,6.723057000000001,6.8,47
The Dead Girl,One life ends. Seven others begin.,2006-11-07,85.0,0,0,3.069605,6.4,66
A Christmas Story,"Peace, Harmony, Comfort and Joy... Maybe Next Year.",1983-11-18,94.0,0,19294144,15.128316,7.4,344
Bella,One person can change your life forever,2006-09-09,91.0,0,0,1.814802,6.7,37
Class of 1984,Class of 1984. Is this the future?,1982-08-20,98.0,4300000,0,5.643023,6.2,66
The Opposite Sex,"A battle of the sexes, winner takes all.",2014-11-08,96.0,3300000,45000,2.964785,4.1,9
Dreaming of Joseph Lees,,1999-10-29,92.0,2000000,7,0.11615,8.0,1
The Class,The dynamics of a multicultural class and its teacher will enlighten.,2008-09-24,128.0,0,28814580,13.437038000000001,6.8,174
Rosemary's Baby,Pray for Rosemary's Baby,1968-06-12,136.0,3200000,33395426,26.180367,7.5,863
The Man Who Shot Liberty Valance,Together For The First Time - James Stewart - John Wayne - in the masterpiece of four-time Academy Award winner John Ford,1962-04-22,123.0,3200000,8000000,11.735287,7.4,265
Adam,A story about two strangers. One a little stranger than the other...,2009-07-29,99.0,0,2277396,8.308442,6.9,150
Feast,,2005-10-14,95.0,0,658573,8.825113,6.1,160
Animal House,It was the Deltas against the rules... the rules lost!,1978-07-27,109.0,2700000,141000000,17.332585,7.0,418
Goldfinger,Everything he touches turns into excitement!,1964-09-17,110.0,2500000,124881062,47.812466,7.2,987
Trainspotting,Choose life.,1996-02-23,93.0,4000000,16491080,63.513324,7.8,2655
The Original Kings of Comedy,We Got Jokes,2000-08-18,115.0,0,0,1.918959,6.3,15
Waking Ned,How far would you go to win a fortune!,1998-09-15,91.0,0,0,5.735912,7.4,54
Coming Home,,2014-05-16,111.0,0,0,6.017273,6.9,49
The Purge,"One night a year, all crime is legal.",2013-05-31,86.0,3000000,89328627,54.40303299999999,6.0,2428
Martin Lawrence Live: Runteldat,,2002-08-01,113.0,3000000,19184015,0.29522600000000004,5.0,1
